{
  "shortName": "FAMILIE_ID",
  "name": [
    {
      "languageCode": "no",
      "value": "Familieidentifikator"
    },
    {
      "languageCode": "en",
      "value": "Family identifier"
    }
  ],
  "description": [
    {
      "languageCode": "no",
      "value": "Identifikator for familie i Microdata"
    },
    {
      "languageCode": "en",
      "value": "Identifier for family in Microdata"
    }
  ],
  "dataType": "LONG",
  "unitType": {
    "shortName": "FAMILIE",
    "pseudonymized": true,
    "name": [
      {
        "languageCode": "no",
        "value": "Familie"
      },
      {
        "languageCode": "en",
        "value": "Family"
      }
    ],
    "description": [
      {
        "languageCode": "no",
        "value": "En familie består av personer som er fast bosatt i samme bolig, og som er knyttet til hverandre som ektefeller, samboere, registrerte partnere og/eller som foreldre og ugifte barn (uansett det ugifte barnets alder). En familie kan høyst bestå av to (påfølgende) generasjoner, og kun ett ektepar/partnerskap/samboerpar. Som familie regnes også enkeltpersoner, slik at alle personer er med i en familie og en husholdning, enten sammen med andre personer, eller alene."
      },
      {
        "languageCode": "en",
        "value": "A family is made up of persons that are permanent residents in the same household, and are connected to each other through marriage, registered partnership and/or as parents with unmarried children (regardless of the unmarried childs age). A family can include a maximum of two (subsequent) generations, and only one marriage/partnership. All individual persons are a member of a family and a houshold, so a single person is also considered a family."
      }
    ]
  },
  "format": "RandomUInt48",
  "valueDomain": {
    "description": [
      {
        "languageCode": "no",
        "value": "Pseudonymisert personnummer"
      },
      {
        "languageCode": "en",
        "value": "Pseudonymized personnummer"
      }
    ]
  }
}